{
  "userId": "user-67890",
  "profile": {
    "firstName": "Jane",
    "lastName": "Smith",
    "email": "jane.smith@company.com",
    "phone": "+1-555-0123",
    "dateOfBirth": "1990-05-15"
  },
  "address": {
    "street": "123 Main Street",
    "city": "San Francisco",
    "state": "CA",
    "zipCode": "94105",
    "country": "USA"
  },
  "preferences": {
    "newsletter": true,
    "notifications": false,
    "theme": "dark",
    "language": "en-US"
  },
  "metadata": {
    "createdAt": "2023-01-15T10:30:00Z",
    "lastLogin": "2023-12-01T14:22:33Z",
    "loginCount": 247,
    "accountType": "premium"
  }
}
